{"algorithm":"ecdsa-sha2-nistp256","blob":"AAAAE2VjZHNhLXNoYTItbmlzdHAyNTYAAAAIbmlzdHAyNTYAAABBBAECAwQFBgcICQoLDA0ODxAREhMUFRYXGBkaGxwdHh8gISIjJCUmJygpKissLS4vMDEyMzQ1Njc4OTo7PD0+P0A=","displayName":"iPad key","fingerprint":"SHA256:GIU4ybieeLjdOEuH\/yYndvEe5hnX23ys7LuuE\/\/Wdr0","id":"12121212-1212-1212-1212-121212121212","protection":"secureEnclave"}
